1508
10.160.0.11
No.	Time	Source	Destination	Protocol	Length	Info
1	0.000000	185.216.140.6	192.168.23.115	TCP	74	40852 → 8081 [SYN] Seq=0 Win=29200 Len=0 MSS=1460 SACK_PERM=1 TSval=12085236 TSecr=0 WS=128
2	0.000042	192.168.23.115	185.216.140.6	TCP	74	8081 → 40852 [SYN, ACK] Seq=0 Ack=1 Win=62643 Len=0 MSS=8961 SACK_PERM=1 TSval=886323161 TSecr=12085236 WS=128
3	0.115472	185.216.140.6	192.168.23.115	TCP	66	40852 → 8081 [ACK] Seq=1 Ack=1 Win=29312 Len=0 TSval=12085265 TSecr=886323161
4	0.115502	185.216.140.6	192.168.23.115	TLSv1	208	Client Hello
5	0.115511	192.168.23.115	185.216.140.6	TCP	66	8081 → 40852 [ACK] Seq=1 Ack=143 Win=62592 Len=0 TSval=886323277 TSecr=12085265
6	0.160060	192.168.23.115	185.216.140.6	TCP	86	8081 → 40852 [PSH, ACK] Seq=1 Ack=143 Win=62592 Len=20 TSval=886323321 TSecr=12085265
7	0.193548	192.168.23.115	185.216.140.6	TCP	104	8081 → 40852 [PSH, ACK] Seq=21 Ack=143 Win=62592 Len=38 TSval=886323355 TSecr=12085265
8	0.228097	192.168.23.115	185.216.140.6	TCP	104	8081 → 40852 [PSH, ACK] Seq=59 Ack=143 Win=62592 Len=38 TSval=886323389 TSecr=12085265
9	0.260310	192.168.23.115	185.216.140.6	TCP	104	8081 → 40852 [PSH, ACK] Seq=97 Ack=143 Win=62592 Len=38 TSval=886323422 TSecr=12085265
10	0.275401	185.216.140.6	192.168.23.115	TCP	66	40852 → 8081 [ACK] Seq=143 Ack=21 Win=29312 Len=0 TSval=12085305 TSecr=886323321
11	0.279822	185.216.140.6	192.168.23.115	TLSv1	73	Alert (Level: Fatal, Description: Unexpected Message)
12	0.279826	192.168.23.115	185.216.140.6	TCP	66	8081 → 40852 [ACK] Seq=135 Ack=150 Win=62592 Len=0 TSval=886323441 TSecr=12085306
13	0.279952	185.216.140.6	192.168.23.115	TCP	66	40852 → 8081 [FIN, ACK] Seq=150 Ack=21 Win=29312 Len=0 TSval=12085306 TSecr=886323321
14	0.291802	192.168.23.115	185.216.140.6	TCP	104	8081 → 40852 [PSH, ACK] Seq=135 Ack=151 Win=62592 Len=38 TSval=886323453 TSecr=12085306