1, 24, 38, 49, 74, 1507, 1523
10.160.0.11
No.	Time	Source	Destination	Protocol	Length	Info
1	0.000000	185.216.140.6	192.168.23.115	TCP	74	40852 → 8081 [SYN] Seq=0 Win=29200 Len=0 MSS=1460 SACK_PERM=1 TSval=12085236 TSecr=0 WS=128
2	0.000042	192.168.23.115	185.216.140.6	TCP	74	8081 → 40852 [SYN, ACK] Seq=0 Ack=1 Win=62643 Len=0 MSS=8961 SACK_PERM=1 TSval=886323161 TSecr=12085236 WS=128
3	0.115472	185.216.140.6	192.168.23.115	TCP	66	40852 → 8081 [ACK] Seq=1 Ack=1 Win=29312 Len=0 TSval=12085265 TSecr=886323161
4	0.115502	185.216.140.6	192.168.23.115	TLSv1	208	Client Hello
5	0.115511	192.168.23.115	185.216.140.6	TCP	66	8081 → 40852 [ACK] Seq=1 Ack=143 Win=62592 Len=0 TSval=886323277 TSecr=12085265
6	0.160060	192.168.23.115	185.216.140.6	TCP	86	8081 → 40852 [PSH, ACK] Seq=1 Ack=143 Win=62592 Len=20 TSval=886323321 TSecr=12085265
7	0.193548	192.168.23.115	185.216.140.6	TCP	104	8081 → 40852 [PSH, ACK] Seq=21 Ack=143 Win=62592 Len=38 TSval=886323355 TSecr=12085265
8	0.228097	192.168.23.115	185.216.140.6	TCP	104	8081 → 40852 [PSH, ACK] Seq=59 Ack=143 Win=62592 Len=38 TSval=886323389 TSecr=12085265
9	0.260310	192.168.23.115	185.216.140.6	TCP	104	8081 → 40852 [PSH, ACK] Seq=97 Ack=143 Win=62592 Len=38 TSval=886323422 TSecr=12085265
10	0.275401	185.216.140.6	192.168.23.115	TCP	66	40852 → 8081 [ACK] Seq=143 Ack=21 Win=29312 Len=0 TSval=12085305 TSecr=886323321
11	0.279822	185.216.140.6	192.168.23.115	TLSv1	73	Alert (Level: Fatal, Description: Unexpected Message)
12	0.279826	192.168.23.115	185.216.140.6	TCP	66	8081 → 40852 [ACK] Seq=135 Ack=150 Win=62592 Len=0 TSval=886323441 TSecr=12085306
13	0.279952	185.216.140.6	192.168.23.115	TCP	66	40852 → 8081 [FIN, ACK] Seq=150 Ack=21 Win=29312 Len=0 TSval=12085306 TSecr=886323321
14	0.291802	192.168.23.115	185.216.140.6	TCP	104	8081 → 40852 [PSH, ACK] Seq=135 Ack=151 Win=62592 Len=38 TSval=886323453 TSecr=12085306
15	0.308876	185.216.140.6	192.168.23.115	TCP	60	40852 → 8081 [RST] Seq=143 Win=0 Len=0
16	0.324858	192.168.23.115	185.216.140.6	TCP	104	8081 → 40852 [PSH, ACK] Seq=173 Ack=151 Win=62592 Len=38 TSval=886323486 TSecr=12085306
17	0.324873	192.168.23.115	185.216.140.6	TCP	66	8081 → 40852 [FIN, ACK] Seq=211 Ack=151 Win=62592 Len=0 TSval=886323486 TSecr=12085306
18	0.343558	185.216.140.6	192.168.23.115	TCP	60	40852 → 8081 [RST] Seq=143 Win=0 Len=0
19	0.375703	185.216.140.6	192.168.23.115	TCP	60	40852 → 8081 [RST] Seq=143 Win=0 Len=0
20	0.395207	185.216.140.6	192.168.23.115	TCP	60	40852 → 8081 [RST] Seq=150 Win=0 Len=0
21	0.407245	185.216.140.6	192.168.23.115	TCP	60	40852 → 8081 [RST] Seq=151 Win=0 Len=0
22	0.440293	185.216.140.6	192.168.23.115	TCP	60	40852 → 8081 [RST] Seq=151 Win=0 Len=0
23	0.440303	185.216.140.6	192.168.23.115	TCP	60	40852 → 8081 [RST] Seq=151 Win=0 Len=0
24	12.137760	192.168.23.115	185.216.140.6	TCP	58	8081 → 52550 [SYN, ACK] Seq=0 Ack=1 Win=62727 Len=0 MSS=8961
25	27.594925	117.237.249.31	192.168.23.115	TCP	60	9293 → 8081 [FIN, ACK] Seq=1 Ack=1 Win=257 Len=0
26	27.594970	192.168.23.115	117.237.249.31	TCP	54	8081 → 9293 [FIN, ACK] Seq=1 Ack=2 Win=491 Len=0
27	27.655626	117.237.249.31	192.168.23.115	TCP	66	13624 → 8081 [SYN] Seq=0 Win=64240 Len=0 MSS=1360 WS=256 SACK_PERM=1
28	27.655652	192.168.23.115	117.237.249.31	TCP	66	8081 → 13624 [SYN, ACK] Seq=0 Ack=1 Win=62727 Len=0 MSS=8961 SACK_PERM=1 WS=128
29	27.854476	117.237.249.31	192.168.23.115	TCP	60	9293 → 8081 [ACK] Seq=2 Ack=2 Win=257 Len=0
30	27.875083	117.237.249.31	192.168.23.115	TCP	60	13624 → 8081 [ACK] Seq=1 Ack=1 Win=66560 Len=0
31	27.916491	192.168.23.115	117.237.249.31	TCP	74	8081 → 13624 [PSH, ACK] Seq=1 Ack=1 Win=62848 Len=20
32	28.135143	117.237.249.31	192.168.23.115	TCP	64	13624 → 8081 [PSH, ACK] Seq=1 Ack=21 Win=66560 Len=10
33	28.135162	192.168.23.115	117.237.249.31	TCP	54	8081 → 13624 [ACK] Seq=21 Ack=11 Win=62848 Len=0
34	28.169655	192.168.23.115	117.237.249.31	TCP	92	8081 → 13624 [PSH, ACK] Seq=21 Ack=11 Win=62848 Len=38
35	28.385863	117.237.249.31	192.168.23.115	TCP	64	13624 → 8081 [PSH, ACK] Seq=11 Ack=59 Win=66560 Len=10
36	28.419905	192.168.23.115	117.237.249.31	TCP	92	8081 → 13624 [PSH, ACK] Seq=59 Ack=21 Win=62848 Len=38
37	28.685175	117.237.249.31	192.168.23.115	TCP	70	13624 → 8081 [PSH, ACK] Seq=21 Ack=97 Win=66304 Len=16
38	28.723703	192.168.23.115	117.237.249.31	TCP	88	8081 → 13624 [PSH, ACK] Seq=97 Ack=37 Win=62848 Len=34
39	28.975292	117.237.249.31	192.168.23.115	TCP	75	13624 → 8081 [PSH, ACK] Seq=37 Ack=131 Win=66304 Len=21
40	29.017753	192.168.23.115	117.237.249.31	TCP	54	8081 → 13624 [ACK] Seq=131 Ack=58 Win=62848 Len=0
41	29.100989	192.168.23.115	117.237.249.31	TCP	77	8081 → 13624 [PSH, ACK] Seq=131 Ack=58 Win=62848 Len=23
42	29.335195	117.237.249.31	192.168.23.115	TCP	68	13624 → 8081 [PSH, ACK] Seq=58 Ack=154 Win=66304 Len=14
43	29.335216	192.168.23.115	117.237.249.31	TCP	54	8081 → 13624 [ACK] Seq=154 Ack=72 Win=62848 Len=0
44	29.370719	192.168.23.115	117.237.249.31	TCP	80	8081 → 13624 [PSH, ACK] Seq=154 Ack=72 Win=62848 Len=26
45	29.615144	117.237.249.31	192.168.23.115	TCP	60	13624 → 8081 [PSH, ACK] Seq=72 Ack=180 Win=66304 Len=5
46	29.647740	192.168.23.115	117.237.249.31	TCP	102	8081 → 13624 [PSH, ACK] Seq=180 Ack=77 Win=62848 Len=48
47	29.965250	117.237.249.31	192.168.23.115	TCP	60	13624 → 8081 [ACK] Seq=77 Ack=228 Win=66304 Len=0
48	54.325336	117.237.249.31	192.168.23.115	TCP	66	64607 → 8081 [SYN] Seq=0 Win=64240 Len=0 MSS=1360 WS=256 SACK_PERM=1
49	54.325360	192.168.23.115	117.237.249.31	TCP	66	8081 → 64607 [SYN, ACK] Seq=0 Ack=1 Win=62727 Len=0 MSS=8961 SACK_PERM=1 WS=128
50	54.555305	117.237.249.31	192.168.23.115	TCP	60	64607 → 8081 [ACK] Seq=1 Ack=1 Win=66560 Len=0
51	54.599726	192.168.23.115	117.237.249.31	TCP	74	8081 → 64607 [PSH, ACK] Seq=1 Ack=1 Win=62848 Len=20
52	54.825180	117.237.249.31	192.168.23.115	TCP	64	64607 → 8081 [PSH, ACK] Seq=1 Ack=21 Win=66560 Len=10
53	54.825199	192.168.23.115	117.237.249.31	TCP	54	8081 → 64607 [ACK] Seq=21 Ack=11 Win=62848 Len=0
54	54.858141	192.168.23.115	117.237.249.31	TCP	92	8081 → 64607 [PSH, ACK] Seq=21 Ack=11 Win=62848 Len=38
55	55.105100	117.237.249.31	192.168.23.115	TCP	64	64607 → 8081 [PSH, ACK] Seq=11 Ack=59 Win=66560 Len=10
56	55.139937	192.168.23.115	117.237.249.31	TCP	92	8081 → 64607 [PSH, ACK] Seq=59 Ack=21 Win=62848 Len=38
57	55.315137	117.237.249.31	192.168.23.115	TCP	70	64607 → 8081 [PSH, ACK] Seq=21 Ack=97 Win=66304 Len=16
58	55.348482	192.168.23.115	117.237.249.31	TCP	88	8081 → 64607 [PSH, ACK] Seq=97 Ack=37 Win=62848 Len=34
59	55.585138	117.237.249.31	192.168.23.115	TCP	75	64607 → 8081 [PSH, ACK] Seq=37 Ack=131 Win=66304 Len=21
60	55.625756	192.168.23.115	117.237.249.31	TCP	54	8081 → 64607 [ACK] Seq=131 Ack=58 Win=62848 Len=0
61	55.707627	192.168.23.115	117.237.249.31	TCP	77	8081 → 64607 [PSH, ACK] Seq=131 Ack=58 Win=62848 Len=23
62	55.925109	117.237.249.31	192.168.23.115	TCP	68	64607 → 8081 [PSH, ACK] Seq=58 Ack=154 Win=66304 Len=14
63	55.925127	192.168.23.115	117.237.249.31	TCP	54	8081 → 64607 [ACK] Seq=154 Ack=72 Win=62848 Len=0
64	55.960485	192.168.23.115	117.237.249.31	TCP	80	8081 → 64607 [PSH, ACK] Seq=154 Ack=72 Win=62848 Len=26
65	56.155125	117.237.249.31	192.168.23.115	TCP	90	64607 → 8081 [PSH, ACK] Seq=72 Ack=180 Win=66304 Len=36
66	56.186174	192.168.23.115	117.237.249.31	TCP	91	8081 → 64607 [PSH, ACK] Seq=180 Ack=108 Win=62848 Len=37
67	56.415192	117.237.249.31	192.168.23.115	TCP	60	64607 → 8081 [ACK] Seq=108 Ack=217 Win=66304 Len=0
68	59.435288	117.237.249.31	192.168.23.115	TCP	62	64607 → 8081 [PSH, ACK] Seq=108 Ack=217 Win=66304 Len=8
69	59.467569	192.168.23.115	117.237.249.31	TCP	84	8081 → 64607 [PSH, ACK] Seq=217 Ack=116 Win=62848 Len=30
70	59.645185	117.237.249.31	192.168.23.115	TCP	60	64607 → 8081 [PSH, ACK] Seq=116 Ack=247 Win=66304 Len=6
71	59.681488	192.168.23.115	117.237.249.31	TCP	106	8081 → 64607 [PSH, ACK] Seq=247 Ack=122 Win=62848 Len=52
72	59.855197	117.237.249.31	192.168.23.115	TCP	68	64607 → 8081 [PSH, ACK] Seq=122 Ack=299 Win=66304 Len=14
73	59.897749	192.168.23.115	117.237.249.31	TCP	54	8081 → 64607 [ACK] Seq=299 Ack=136 Win=62848 Len=0
74	60.106827	192.168.23.115	117.237.249.31	TCP	76	8081 → 64607 [PSH, ACK] Seq=299 Ack=136 Win=62848 Len=22
75	60.355168	117.237.249.31	192.168.23.115	TCP	60	64607 → 8081 [ACK] Seq=136 Ack=321 Win=66304 Len=0
76	60.362296	192.168.23.115	117.237.249.31	TCP	78	8081 → 64607 [PSH, ACK] Seq=321 Ack=136 Win=62848 Len=24
77	60.575145	117.237.249.31	192.168.23.115	TCP	62	64607 → 8081 [PSH, ACK] Seq=136 Ack=345 Win=66048 Len=8
78	60.575171	192.168.23.115	117.237.249.31	TCP	54	8081 → 64607 [ACK] Seq=345 Ack=144 Win=62848 Len=0
79	60.610475	192.168.23.115	117.237.249.31	TCP	85	8081 → 64607 [PSH, ACK] Seq=345 Ack=144 Win=62848 Len=31
80	60.795147	117.237.249.31	192.168.23.115	TCP	60	64607 → 8081 [PSH, ACK] Seq=144 Ack=376 Win=66048 Len=6
81	60.830828	192.168.23.115	117.237.249.31	TCP	106	8081 → 64607 [PSH, ACK] Seq=376 Ack=150 Win=62848 Len=52
82	61.045105	117.237.249.31	192.168.23.115	TCP	60	64607 → 8081 [PSH, ACK] Seq=150 Ack=428 Win=66048 Len=6
83	61.085756	192.168.23.115	117.237.249.31	TCP	54	8081 → 64607 [ACK] Seq=428 Ack=156 Win=62848 Len=0
84	61.251650	192.168.23.115	117.237.249.31	TCP	93	8081 → 64607 [PSH, ACK] Seq=428 Ack=156 Win=62848 Len=39
85	61.465121	117.237.249.31	192.168.23.115	TCP	60	64607 → 8081 [ACK] Seq=156 Ack=467 Win=66048 Len=0
86	61.536316	192.168.23.115	117.237.249.31	TCP	78	8081 → 64607 [PSH, ACK] Seq=467 Ack=156 Win=62848 Len=24
87	61.765108	117.237.249.31	192.168.23.115	TCP	60	64607 → 8081 [ACK] Seq=156 Ack=491 Win=66048 Len=0
